ssoc,title,description
22150,"Other specialist medical practitioner (other specialisations) (e.g. occupational physician, radiation oncologist)",This group includes specialist medical practitioners (other specialisations) not elsewhere classified.
22200,"Registered nurse and other nursing professionals (e.g. clinical nurse, nurse educator, excluding enrolled nurse)","Registered nurse and other nursing professionals provides professional nursing care and advice in hospitals, clinics, private homes, schools, maternal, child health centres, nurseries or other establishments."
22301,Traditional Chinese medicine practitioner,"Traditional Chinese medicine practitioner conducts examinations, makes diagnosis and prescribes herbs or other medicines for treatment of various kinds of diseases and disorders of the human body. He/she advises patient on regimen necessary to preserve or restore health."
22302,Traditional Chinese medicine acupuncturist,"Traditional Chinese medicine acupuncturist diagnoses, treats, and prevents disorders by stimulating specific acupuncture points within the body using acupuncture needles. He/she may also use cups, nutritional supplements, therapeutic massage, acupressure, and other alternative health therapies."
22500,Veterinarian,"Veterinarian diagnoses, prevents and treats diseases, injuries and dysfunctions of animals. He/she inoculates animals against diseases and advises on care and breeding of animals. He/she may provide care to a wide range of animals or specialise in the treatment of a particular animal group or in a particular specialty area, or provide professional services to commercial firms producing biological and pharmaceutical products."
22611,General dental practitioner,"General dental practitioner performs diagnostic, preventive and curative services for dental and oral diseases and disorders. He/she examines teeth and oral cavity, using X-ray and other diagnostic tools as necessary, and prepares a plan of treatment. He/she may organise oral health services and advise on public dental health questions."
22612,Specialised dentist (e.g. orthodontist),"Specialised dentist specialises in giving surgical, medical and other forms of treatment for particular types of dental and oral diseases and disorders. He/she performs tasks similar to those of general dental practitioner but specialises in a particular branch of dentistry, such as prosthodontics, periodontics, orthodontics, pedodontics, endodontics, crown and bridge or oral surgery."
22621,Pharmacist (patient care),"Pharmacist (patient care) makes or dispenses medicaments and related preparations according to prescriptions or formulae. He/she also performs tests to determine identity, purity and strength of drugs and preserves pharmaceuticals against deterioration."
22629,Other pharmacists,This group includes pharmacists not elsewhere classified.
22631,Occupational health and safety professional,"Occupational health and safety professional assesses, plans and implements programmes to recognise, monitor and control factors that can potentially affect human health, and ensures that working conditions are safe and healthy. He/she also promotes ergonomic principles within the workplace such as matching furniture, equipment and work activities to the needs of employees in addition to providing education, information, training, and advice on aspects of occupational hygiene and environmental health."
22632,Environmental officer (public health),"Environmental officer (public health) assesses, plans and implements environmental health policies, prevention programmes and strategies for communicable diseases, food safety, waste water treatment and disposal systems, recreation and domestic water quality, contaminated and hazardous substances. He/she implements and enforces environmental health legislations and regulations."
22639,Other environmental and occupational health and hygiene professionals,This group includes environmental and occupational health and hygiene professionals not elsewhere classified.
22640,Physiotherapist,"Physiotherapist assesses, plans and implements rehabilitative programmes that improve or restore human motor functions, maximise movement ability, relieve pain syndromes, and treat or prevent physical challenges associated with injuries, diseases and other impairments. He/she applies a broad range of physical therapies and techniques such as movement, ultrasound, heating, laser and other techniques. He/she administers muscle, nerve, joint and functional ability tests to identify and assess physical problems of patients."
22651,Dietitian,"Dietitian plans and supervises the preparation of therapeutic or other diets for individuals or for groups in hospitals, institutions and other establishments. He/she gives instruction in selection and proper preparation of food according to dietetic principles and performs duties related to nutrition programmes."
22652,Nutritionist,"
Nutritionist appraises various factors related to nutrition and food problems. He/she studies the nutritional value of foodstuffs and dishes, and advises on the composition of different meals or dishes. He/she plans and executes nutrition elements of health programmes. He/she may investigate the state of nutrition in the community and serve as nutrition adviser to health programmes."
22661,Audiologist,"Audiologist assesses, diagnoses and treats patients with audiological and vestibular disorders caused by infectious, genetic, traumatic or degenerative conditions such as hearing loss, tinnitus, dizziness, imbalance, hyperacusis and auditory processing difficulties. He/she interprets audiometric test results alongside other medical, social and behavioural diagnostic data."
22662,Speech therapist,"Speech therapist focuses on the aetiology, assessment, diagnosis, treatment, and prevention of communication and swallowing disorders in people of all ages in order to help them maintain, promote, improve, initiate, or recover the ability to communicate both verbally and nonverbally. He/she addresses the development of language, speech, vocal and hearing functions, and disorders and disabilities in the cranial, facial, and oral area."
22670,Optometrist,"Optometrist provides diagnosis, management and treatment services for disorders of the eyes and visual system. He/she counsels on eye care and prescribes optical aids or other therapies for visual disturbance. He/she advises on visual health matters such as contact lens care, vision care for the elderly, optics, visual ergonomics and occupational and industrial eye safety."
22680,Occupational therapist,"Occupational therapist helps people of all ages to improve their ability to perform tasks in their daily living and working environments. He/she works with individuals who have conditions that are physically, developmentally, socially or emotionally disabling. He/she also helps them to develop, recover, or maintain daily living and work skills. He/she helps clients not only to improve their basic motor functions and reasoning abilities, but also to compensate for permanent loss of function."
22691,Chiropractor,"Chiropractor relieves illnesses believed due to pressure upon the nervous system at the spine by adjusting joints of the spine. He/she diagnoses disorders by making a structural analysis of body, using manipulative and laboratory or instrumental methods and corrects the position of displaced vertebrae by manipulation."
22692,Podiatrist,"Podiatrist studies foot physiology and pathology from a structural and functional standpoint. He/she assesses, diagnoses, and treats physical, sporting injuries, rehabilitation, medical and surgical problems of the foot and lower limb in clinical practice."
22693,Medical diagnostic radiographer,"Medical diagnostic radiographer plans, prepares and performs diagnostic imaging examinations and post processing, with a wide range of equipment and techniques using X-rays, strong magnetic fields or Magnetic Resonance Imaging (MRI) and high frequency sound (ultrasound)."
22694,Radiation therapist,"Radiation therapist provides radiation therapy to patients as prescribed by a radiation oncologist according to established practices and standards. He/she designs treatment plan and administers prescribed course of radiation treatment. He/she reviews prescription and diagnosis, acting as liaison with physician and supportive care personnel."
22699,Other health professionals n.e.c.,This group includes health professionals not elsewhere classified.
23101,University lecturer,"University lecturer prepares and delivers lectures while conducting tutorials, seminars and laboratory experiments in one or more subjects within a prescribed course of study at a university. He/she supervises and grades experimental, practical work and examinations undertaken by students in addition to conducting academic research and publishing his/her findings in his/her respective field."
23102,Polytechnic lecturer,"Polytechnic lecturer prepares and delivers lectures while conducting tutorials, seminars and laboratory experiments in one or more subjects within a prescribed course of study at a polytechnic. He/she supervises and grades experimental, practical work and examinations undertaken by students in addition to conducting academic research and publishing his/her findings in his/her respective field."
23103,Teaching assistant/Tutor in university,"Teaching assistant/Tutor in university is employed on a temporary contract at a university for teaching-related responsibilities. He/she assists the professor, lecturer or teacher of the specific course they are in charge of in the preparation of lectures and of exams, grading papers and exams and leading review and feedback sessions for the students."
23109,"Other university, polytechnic and higher education teachers",This group includes university and higher education teachers not elsewhere classified.
23200,Junior college and pre-university teacher (including integrated programme year 5-6 teacher),Junior college and pre-university teacher (including integrated programme year 5-6 teacher) teaches one or more subjects at the junior college or pre-university level.
23300,Technical/Vocational/Commercial education institute teacher and trainer,Technical/Vocational/Commercial education institute teacher and trainer teaches or instructs vocational or occupational subjects in adult and further education institutions and to senior students in secondary schools and colleges. He/she prepares students for employment in specific occupations or occupational areas for which university or higher education is not normally required.
23400,Secondary school teacher (including integrated programme year 1-4 teacher),Secondary school teacher (including integrated programme year 1-4 teacher) teaches one or more subjects at secondary school level.
23500,Primary school teacher,Primary school teacher teaches a range of subjects at the primary school level.
23611,Education methods adviser,"Education methods adviser studies curricula, teaching methods and other educational practices, and investigates the effectiveness of established educational practices. He/she advises and makes recommendations to education authorities concerning the introduction of improved methods, procedures and revisions in curricula in addition to organising and directing in-service training seminars or special readaptation courses for teachers."
23612,Instructional designer and technologist,"Instructional designer and technologist develops instructional materials and products and assists in the technology-based redesign of courses. He/she assists teaching professionals in learning about, becoming proficient in, and applying instructional technology."
23619,Other education methods specialists,This group includes education methods specialists not elsewhere classified.
23621,Teacher of the visually impaired,Teacher of the visually impaired specialises in teaching visually impaired students which includes reading and writing in braille. He/she designs or modifies curricula according to students' needs and abilities in addition to administering various forms of assessment to evaluate the progress of each student.
23622,Early intervention teacher for infants and children,"Early intervention teacher for infants and children teaches academic, social, and life skills to preschool-aged students with special learning, emotional, or physical needs."
23629,Other special education teachers,This group includes special education teachers not elsewhere classified.
23690,Other teaching professional n.e.c.,This group covers teaching professionals not elsewhere classified.
24111,Accountant (excluding tax accountant),"Accountant (excluding tax accountant) plans, organises and administers accounting systems for individuals and establishments. He/she examines and analyses the accounting and financial records of individuals and establishments to ensure accuracy and compliance with established accounting standards and procedures."
24112,Auditor (accounting),"Auditor (accounting) plans and conducts audit of accounts, book-keeping of records and financial statements of private persons, enterprises, institutions and governmental organisations. He/she inspects the recording of transactions in daybooks and journals and verifies the transfer of journal entries to ledgers; inspects and verifies negotiable securities and notes receivable and payable. He/she also recommends improvements in accounting procedures or other desirable action."
24113,Tax accountant,"Tax accountant prepares tax returns, advises on taxation problems and contests disputed claims before tax officials."
24121,Financial/Investment adviser (e.g. relationship manager),"Financial/Investment adviser develops financial plans for individuals and organisations, and invests and manages funds on their behalf."
24122,Business valuer,"Business valuer provides valuation assessements of business entities, stock and other securities and intangible assets, in order to assist his/her clients in strategic decision-making procedures such as mergers and acquisitions, litigation cases, bankruptcy, taxation compliance and general restructuring of the companies."
24131,"Financial analyst (e.g. equities analyst, credit analyst, investment research analyst)","Financial analyst conducts economic research and elicits valuable analyses on financial matters such as profitability, liquidity, solvency, and asset management. He/she also provides recommendations on financial matters for decision-making processes."
24132,Compliance officer/Risk analyst (financial),"Compliance officer/Risk analyst (financial) enforces or ensures compliance with laws and regulations governing financial and securities institutions as well as financial and real estate transactions. He/she may also examine, verify, or authenticate records."
24133,Fund/Portfolio manager (including asset allocator),"Fund/Portfolio manager plans, directs, or coordinates investment strategy or operations for a large pool of liquid assets supplied by institutional investors or individual investors. He/she recommends investments and investment timing to companies, investment firm staff, or the investing public. He/she also prepares plans of action for investment based on financial analyses."
24134,Treasury manager,"Treasury manager determines and oversees the financial strategic policies of a company or organisation. He/she uses cash management techniques like account organisation, cash flow monitoring, liquidity planning and control. He/she is also involved in risk management, including currency and commodity risks and maintains close connection with banks and rating agencies."
24135,Financial product structurer,"Financial product structurer conceptualises, designs and develops new financial products. He/she also determines the pricing of the financial products and monitors the performance of the new financial products."
24139,Other financial analysts and related professionals,This group includes financial analysts and related professionals not elsewhere classified.
24141,Securities and finance dealer,"Securities and finance dealer purchases and sells securities such as stocks, bonds and shares on his/her own account or employer's account. He/she monitors the performance of the securities traded, assessing their stability or speculative tendancies. He/she calculates the securities price and places orders."
24142,Foreign exchange dealer,"Foreign exchange dealer buys and sells foreign currencies on his/her own account or employer's account, in order to secure a profit on fluctuations in foreign exchange rates. He/she executes trading activities as per trading plans, monitors portfolio positions and market conditions. He/she undertakes technical analysis of economic information (market liquidity and volatility) to predict the future rates of currencies on the foreign exchange market."
24143,Financial derivatives dealer,"Financial derivatives dealer buys and sells financial derivatives on his/her own account or employer's account. He/she executes trading activities as per trading plans, monitors portfolio positions and market conditions."
24149,Other finance dealers,This group includes finance dealers not elsewhere classified.
24151,Securities and finance broker,"Securities and finance broker buys and sells securities, stocks, bonds and other financial instruments on behalf of his/her clients on a commission basis. He/she executes trading activities as per cilents' instructions. He/she also recommends transactions to clients."
24152,Foreign exchange broker,"Foreign exchange broker buys and sells foreign currencies on behalf of his/her clients on a commission basis. He/she executes trading activities as per cilents' instructions. He/she also undertakes technical analysis of economic information, such as market liquidity and volatility, to predict the future rates of currencies on the foreign exchange market."
24153,Financial derivatives broker,Financial derivatives broker buys and sells financial derivatives on behalf of his/her clients on a commission basis. He/she executes trading activities as per cilents' instructions.
24154,Commodities and freight derivatives broker,Commodities and freight derivatives broker buys and sells commodities and freight derivatives on behalf of his/her clients on a commission basis. He/she executes trading activities as per cilents' instructions.
24159,Other finance brokers,This group includes finance brokers not elsewhere classified.
24160,Insurance underwriter,"Insurance underwriter identifies and measures the risks associated with an activity, determines whether this risk is insurable and what the terms of that acceptance are. He/she assesses a risk according to the likelihood of a claim being made by weighing up a number of factors and asking for detailed information from prospective clients (policyholders)."
24211,Management consultant,"Management consultant conducts organisational studies and evaluations, designs systems and procedures, conducts work simplification and measurement studies, and prepares operations and procedures manuals to assist management in operating more efficiently and effectively."
24212,Business consultant,"Business consultant analyses the position, structure and processes of businesses and companies and offers services or advice to improve them. He/she researches and identifies business processes such as financial inefficiencies or employee management and devises strategical plans to overcome these difficulties."
24213,Business and financial project management professional,"Business and financial project management professional manages, oversees and implements business and financial projects. He/she ensures that customers' needs are met and that the project implementation plan is progressing in a timely and satisfactory manner, and prepares projects status reports for management."
24220,Policy administration professional (e.g. policy analyst),"Policy administration professional develops and analyses policies guiding the design, implementation and modification of government and commercial operations and programmes."
24231,Human resource consultant (excluding executive search consultant),"Human resource consultant (excluding executive search consultant) provides consultancy services on personnel functions relating to employee recruitment, placement, training, promotion, compensation, and employee-management relations or other areas of personnel policy. He/she studies and analyses jobs performed in an establishment by various means, including interviews with workers, supervisors and management, and writing detailed position, job or occupation descriptions from information obtained."
24232,Executive search consultant,"Executive search consultant provides suitable candidates to employers according to the specific job profiles requested. He/she conducts tests and interviews with job seekers, shortlists potential candidates for employers and matches these candidates to appropriate jobs. He/she also maintains relationships with employers to offer his/her services on a more long-term basis."
24233,Personnel/Human resource officer,"Personnel/Human resource officer develops and implements strategies that help their employers select and retain appropriately qualified staff within that business sector. He/she recruits staff, prepares job advertisements, interviews and short-lists people, negotiates with employment agencies, and sets up working conditions. He/she also administers the payroll, reviews salaries and advises on remuneration benefits and employment law. He/she may arrange for training opportunities to enhance employees' performance."
24234,Industrial relations officer,Industrial relations officer works with union leaders and members and company's human resource team and management to maintain and improve the welfare of workers. He/she resolves workplace disputes and assists in negotiating collective agreements with unions and management for the workers. He/she also plans and organises membership and social activities. He/she represents workers who do not have the ability to defend their rights as employees.
24240,Training and staff development professional,"Training and staff development professional plans, develops, implements and evaluates training and development programs to ensure management and staff acquire the skills and develop the competencies required by organisations to meet organisational objectives. He/she prepares and develops instructional training material and aids such as handbooks, visual aids, online tutorials, demonstration models, and training reference documentation. He/she may analyse organisational training needs or evaluate training effectiveness."
24251,Intellectual property agent,"Intellectual property agent provides professional advice on the registrability of intellectual property (IP) and the drafting of specifications for submission of an IP application before the IP Office, as well as assistance in the registration and renewal of IP. He/she also acts principally for his/her clients in the prosecution of infringements and provides advice on the protection and commercialisation of IP."
24252,Intellectual property examiner,Intellectual property examiner assesses and determines the granting of patent and trade marks. He/she reviews patent applications and examines inventions from a technical standpoint and ensures that the invention is novel. He/she reviews and processes trade mark applications under the Trade marks and Madrid Protocol.
24291,Research officer (non-statistical),"Research officer (non-statistical) manages research projects that aim to investigate and provide reports on business issues. He/she performs research by gathering information through interviews, focus groups and questionnaires. He/she also organises and analyses the gathered information using computer software programs, and explores solutions to address problems and needs."
24299,Other administration professionals n.e.c.,This group includes administration professionals not elsewhere classified.
24311,Creative advertising professional,Creative advertising professional oversees the creation process of advertisements and commercials. He/she provides advice to companies and organisations about the development of their advertising strategies and on advertising-related topics covering a more general strategic approach.
24312,Market research professional,"Market research professional collects product information gathered in market research, in terms of prices and competition, and study it to draw conclusions. He/she identifies the potential customers of a product, the target group and the way they can be reached. He/she also analyses cross selling and interdependencies between different products and their placement, and prepares information helpful for the development of marketing strategies."
24313,Marketing strategy/planning professional,"Marketing strategy/planning professional manages, plans and develops strategy based on information collected from market research. He/she advises managers and clients on strategies and campaigns to reach target markets, create consumer awareness and hence effectively promote the attributes of goods and services."
24314,"Digital marketing professional (e.g. online, social media, e-commerce marketing professional)","Digital marketing professional leads and monitors the execution of all digital activities, manages the online review sites and responds accordingly. He/she creates and manages online and digital platforms, measures and reports the performance of all digital marketing activities against goals, as well as provides monthly reports on these trends. He/she directs and supports the needs of the markets to ensure the maximisation of all marketing channels."
