ssoc,title,description
11110,Legislator,"Legislator determines, formulates and directs government policies. He/she makes, ratifies, amends or repeals laws, public rules and regulations within a statutory or constitutional framework."
11121,Senior government official,"Senior government official plans, organises and controls the activities of a government department, government administrative agency or intergovernmental organisation. He/she advises political leaders or governing body on important policy questions. He/she makes decisions within his/her broad discretionary power and performs other high-level functions in connection with government administration."
11122,Senior statutory board official,"Senior statutory board official plans, organises and controls the activities of a statutory board or such fields of public administration as may be defined in the empowering legislation."
11140,Senior official of political party organisation,"Senior official of political party organisation determines, formulates and directs the implementation of policies of political-party organisations."
11150,"Senior official of employers', workers' and other economic-interest organisation","Senior official of employers', workers' and other economic-interest organisation determines, formulates and directs the implementation of policies of employers', workers' and other economic-interest organisations."
11160,Senior official of humanitarian and other special-interest organisation,"Senior official of humanitarian and other special-interest organisation determines, formulates and directs the implementation of policies of humanitarian and other special-interest organisations, such as humanitarian or charitable organisations, or sports associations, and represents their organisations and act on their behalf."
11201,Managing director/Chief executive officer,"Managing director/Chief executive officer participates as member of board of directors to formulate and review the policies and plan, direct, coordinate and evaluate the overall activities of enterprises or organisations with the support of other managers."
11202,Company director,Company director participates as a member of one or more boards of directors in formulating policies governing the operations of a company or companies. The board and its members are responsible to the proprietors or shareholders for ensuring that policies formulated are implemented and progressively amended in the light of changing circumstances.
11203,Chief operating officer/General Manager,"Chief operating officer/General manager is the second in command of a company after the chief executive officer. He/she ensures that the daily operations of the company run smoothly and develops company policies, rules and goals."
12111,Budgeting and financial accounting manager (including financial controller),"Budgeting and financial accounting manager (including financial controller) plans, organises and controls the financial operations of an organisation. He/she participates in formulating the financial policy of the organisation. He/she assesses the financial situation of the enterprise, consults the general manager and departmental managers on financial aspects of production, research and other programmes, presents budget proposals to the governing body or board of directors and advises on general financial questions such as the effective use of resources. He/she also controls and coordinates budgetary and accounting activities."
12112,Administration manager,"Administration manager plans, organises and controls the internal administration of an organisation and participates in formulating its administrative policy, such as the organisation's needs for records, information, communication and other common services. He/she oversees the common services and coordinates departmental reporting and record-keeping systems, negotiates with suppliers of business services and other services. He/she may act as secretary to the board of directors or governing body. He/she may also, in non-profit-making organisations, have responsibility for maintaining membership records, ensuring that examination and registration regulations are observed."
12113,Audit manager,"Audit manager oversees a portfolio of audit engagements or the internal audit of an organisation. He/she plans, organises and leads audit engagements. He/she reviews and provides technical expertise to ensure the quality of audit work performed is in compliance with professional standards and requirements. He/she establishes and reviews the internal audit plan, ensuring that internal audit goals and objectives are met."
12121,Personnel/Human resource manager,"Personnel/Human resource manager plans, designs and implements processes related to the human capital of companies. He/she develops programs for recruiting, interviewing, and selecting employees based on the profiles and skills required in the company. He/she manages compensation and development programs for the company's employees comprising trainings, skill assessments and yearly evaluations, promotion, expatriate programs, and general assurances of the well-being of the employees in the workplace."
12122,Industrial relations manager,"Industrial relations manager maintains relations between the management, its employees and all the entities connected with the organisations like customers, unions, governing agencies and stakeholders. He/she plans, organises and controls industrial relations and personnel activities of an organisation and participates in formulating the recruitment, training, wages, safety, welfare and other personnel policies of the organisation. He/she may represent the organisation before industrial arbitration courts or other labour tribunals and may also specialise in industrial relations work and be designated accordingly."
12123,Training manager,"Training manager plans, directs and coordinates the training and development activities of the staff of an organisation. He/she may also design and develop new training modules and supervise all the activities related to the planning and delivery of these programmes."
12131,Policy manager,"Policy manager formulates, develops, implements and evaluates policies to ensure that the strategic objectives of the organisation are met. He/she oversees the production of policy positions for the organisation in relation to policies, legislations and programmes, including in fields such as environmental, ethics, quality, transparency, and sustainability."
12132,Strategic planning manager,"Strategic planning manager plans, directs and coordinates the strategic initiatives of the organisation. He/she ensures consistency in the implementation of the strategic plans. He/she creates content and narration for presenting new business models, and designs strategic roadmaps for innovation and commercial activities. He/she helps to interpret the overall strategic plan and may create a detailed strategic plan for each one of the departments and branches."
12133,Risk management manager,"Risk management manager plans, organises, directs and coordinates the management of risk exposure and compliance policies in the organisation. He/she develops and defines organisational policies, frameworks and strategies related to risks and compliance. He/she establishes risk criteria for compliance and oversees identification, monitoring, measurement and mitigation of operational risks."
12191,Premises and facilities maintenance manager (excluding building security manager),"Premises and facilities maintenance manager (excluding building security manager) plans, directs and coordinates operations and functionalities of facilities and buildings. He/she may oversee multiple facilities and grounds of an organisation."
12192,Landscape manager,"Landscape manager plans, directs and coordinates enhancement and implementation for softscapes and hardscapes. He/she ensures that the softscapes and hardscapes are enhanced or built to specifications. He/she may source for suitable plants that can fit and blend into the landscape."
12193,Cleaning operations manager,"Cleaning operations manager plans, directs and monitors the cleaning operations of the cleaning company or cleaning department. He/she oversees the management of resources on project sites. He/she develops cleaning operational plans and manages service contracts and incidents related to cleaning operations."
12194,Security manager,"Security manager leads and sets strategic directions for the security agency or security department. He/she plans, directs and monitors the security operations. He/she manages the resources of the security agency or security department. He/she may oversee response to incidents, design contingency plans and develop security plans for his/her customers."
12195,Intellectual property manager,"Intellectual property manager manages the organisation's intellectual property (IP) portfolio and identifies commercialisation opportunities that are beneficial to the organisation. He/she assesses risks, reviews IP due diligence activities, monitors IP infringements and coordinates any required prosecution and enforcement actions. He/she may also oversees IP prosecution portfolio."
12199,Other business services and administration managers n.e.c.,This group includes business services and administration managers not elsewhere classified.
12211,Sales manager,"Sales manager plans, directs and coordinates sales operations in an organisation. He/she analyses data, builds sales plans and sets sales targets and goals. He/she leads the development of sales strategies, expands sales channels and network. He/she may drive client relationships by managing sales related customer service."
12212,Business development manager,"Business development manager conceptualises sales strategies and business plans. He/she implements market expansion and new market plans for business growth. He/she prospects, develops relationships with potential customers and formulates new account development strategies. He/she may manage the allocation of business resources, including manpower and internal assets of specific projects."
12213,Regional sales manager,"Regional sales manager plans, directs and coordinates sales operations in an organisation across multiple countries. He/she analyses data, builds sales plans and sets sales targets and goals for the sales territories. He/she leads the development of sales strategies, expands sales channels and network across multiple countries. He/she may drive client relationships by managing regional sales related customer service."
12214,Merchandising/category manager,"Merchandising/Category manager oversees the implementation of merchandising strategies and defines the sales programme for specific product groups. He/she develops strategic partnerships, manages product assortment, drives product development and budget management. He/she may also review market and industry trends to drive appeal of merchandises to target customers."
12215,Online sales channel manager,"Online sales channel manager defines the sales programme for e-commerce, i.e. goods and services sold via e-mail, Internet and social media. He/she assists in planning of the online sales strategy and identifying marketing opportunities. He/she also analyses competitor sites, reviews the site performance and analytics."
12221,Advertising/Public relations manager,"Advertising/Public relations manager plans, directs and coordinates the advertising, public relations and public information activities of enterprises and organisations, or of enterprises that provide related services to other enterprises and organisations."
12222,Marketing manager,"Marketing manager plans, directs and coordinates marketing operations in an organisation. He/she drives the organisation's business strategies by setting direction for the organisation's marketing campaigns, programmes and communication plans. He/she develops marketing strategies and plans by detailing cost and resources needed. He/she analyses the profitability of these plans, develops pricing strategies, and strives to raise awareness on products and companies among targeted customers."
12230,Research and development manager,"Research and development manager plans, directs and coordinates the research and development activities of an enterprise or organisation or of enterprises that provide related services to other enterprises and organisations."
12241,Customer service manager,"Customer service manager oversees overall customer service excellence, develops process review and innovation frameworks, and implements initiatives to review the customer service process. He/she also manages the overall service quality and customer relationship management resources, including manpower, internal assets and external vendors. He/she investigates and solves customers' problems, which may be complex or long-standing problems that have been passed on by customer service assistants. He/she analyses statistics or other data to determine the level of customer service an organisation is providing."
12242,Call centre manager,"Call centre manager plans, organises and controls the operations of call centres and maintains sound customer relations. He/she sets the objectives of the service per month, week, and day and manages the results obtained in the centre and addresses problems faced in the operations."
13100,Production manager in agriculture and fisheries,"Production manager in agriculture and fisheries plans, directs, and coordinates growing and production of crops and fish."
13210,Manufacturing manager,"Manufacturing manager plans, directs and coordinates activities concerned with the production of goods, the production and distribution of electricity, gas and water, and the collection, treatment and disposal of waste. He/she may manage the production department of large enterprise or be the manager of small manufacturing company."
13230,Construction manager,"Construction project manager plans, directs and coordinates the construction of civil engineering projects, buildings and dwellings."
13241,Supply and distribution/Logistics/Warehousing manager,"Supply and distribution/Logistics/Warehousing manager plans, directs, or coordinates transportation, storage, or distribution activities in accordance with organisational policies and applicable government laws or regulations."
13242,Procurement/Purchasing manager,"Procurement/Purchasing manager buys goods, equipment and services for the company while trying to ensure the most competitive prices. He/she negotiates contracts, reviews the quality of products and analyses the use and resale of goods and services."
13243,Transport/technical operations manager (except port/shipping operations),"Transport/Technical operations manager (except port/shipping operations) plans, organises and controls operational activities on road, rail or air. He/she formulates policies to ensure the efficient handling of freight and passenger traffic. He/she assesses the adequacy of existing transport facilities and time schedule while devising or approving methods and procedures for operating freight and passenger services."
13244,Postal service manager,"Postal service manager plans, organises, directs, controls and evaluates the activities and operations of postal facilities and courier service companies, or of operational divisions within courier service companies. He/she coordinates the duties of supervisors and other staff in addition to managing the accurate and expedient movement of mail and parcels through postal and parcel sorting facilities."
13245,Port/Shipping operations manager,"Port/Shipping operations manager oversees port, shipping and cargo operations. He/she oversees the rectification activities of equipment abnormalities and drives process improvement initiatives. He/she may provide advice to ships and management on cargo requirements, tank cleaning, stability and stress and maintain all statutory requirements for the ships."
13291,Technical/Engineering services manager (excluding transport),"Technical/Engineering services manager (excluding transport) manages and deploys technical and engineering resources. He/she manages the provision of technical services internally or to customers and business partners to install, maintain and repair equipment and systems. He/she formulates strategies to ensure the technical competitiveness of the organisation's products in the market, and drives the engineering development of products. He/she may also provide technical expertise in troubleshooting technical issues in products or equipment."
13292,Quality control/assurance manager,"Quality control/assurance manager defines the quality assurance of the organisation and also ensures that the production or service standards meets regulatory requirements. He/she manages the development and review of the organisation‘s quality system and Standard Operating Procedures (SOPs), with reference to the regulatory requirements, and ensures compliance."
13299,Other production and operations managers n.e.c. (e.g. mining manager),This group includes production and operations managers not elsewhere classified.
13301,Chief information officer/Chief technology officer/Chief security officer,Chief information officer/Chief technology officer/Chief security officer defines and implements the information and communication technology (ICT) strategy and governance. He/she determines the necessary resources for the ICT strategy implementation in addition to anticipating ICT market evolutions and company business needs.
13302,Software and applications manager,Software and applications manager oversees the acquisition and development of software systems in organisational units. He/she monitors the results and quality of the different software solutions and projects implemented in the organisation.
13303,"Network, communications and infrastructure manager","Network, communications and infrastructure manager drives the implementation of strategy for network and communications infrastructure operations and maintenance to ensure availability of stable and secure systems. He/she identifies problems and presents new methodologies and solutions to key stakeholders and also enhances and improves the delivery of infrastructure operations and maintenance services."
13304,ICT service manager,"ICT service manager plans and directs the information processing activities of the organisation along with coordinating the effective design, implementation and operation of management information systems and applications. He/she oversees the maintenance and upgrading of support systems and conducts on-site training to promote efficient operations."
13410,Pre-school education manager,"Pre-school education manager plans, directs, coordinates and evaluates the provision of care for children in before-school, after-school, vacation and day care centres and services. He/she oversees the planning, implementation and monitoring of pedagogy and programmes for the centre."
13420,Health services manager,"Health services manager plans, directs, coordinates and evaluates the provision of clinical and community healthcare services in hospitals, clinics, public health agencies and similar organisations."
13430,Aged care services manager,"Aged care services manager plans, directs, coordinates and evaluates the provision of residential and personal care services for individuals and families who are in need of such services due to the effects of ageing."
13441,Social service manager,"Social service manager plans, directs and coordinates the provision of social and community service programmes such as income support, family assistance, children's services and other community programmes and services."
13442,Volunteer manager,"Volunteer manager plans, directs, or coordinates the activities of a social service program or community outreach organisation. He/she oversees the program or organisation's budget and policies regarding participant involvement, program requirements, and benefits."
13451,School principal,"School principal plans, directs, coordinates and evaluates the educational and administrative aspects of education and training services, primary and secondary schools, colleges and faculties and departments in universities and other educational/training institutions. He/she provides overall leadership in various areas of the school including professional development, school administration and operations to ensure the provision of a holistic education for students."
13459,"Other education managers (including registrars, deans of education institutions and heads of training institutions)",This group includes education managers not elsewhere classified.
13461,Financial services manager,"Financial services manager coordinates and oversees the operations of an institution or a branch of an institution that offers financial services. He/she leads the team of officers that provide financial services and run banking operations, related to wealth planning, trust administration, credit and lending, private/personal banking, commercial banking, etc."
13462,Insurance services manager,"Insurance services manager coordinates and oversees the operations of an institution or a branch of an institution that offers insurance services. He/she leads the team of officers providing insurance services, such as insurance advice, processing of insurance claims and underwriting of insurance."
13463,Financial risk manager,"Financial risk manager plans, directs and coordinates the financial risk management activities of the organisation. He/she oversees the development and compliance of financial risk (e.g. credit risk, market risk, liquidity risk, etc.) management policies and strategies to meet the requirements of applicable regulations (including financial crimes) and organisational framework."
13491,"National security, civil defence and immigration managerial officer","National security, civil defence and immigration managerial officer leads a department or division of police officers (including auxiliary police officers), fire-fighting and rescue officers or customs/immigration officers. He/she provides overall direction and management for his/her department or division. He/she manages manpower resources, maintains the professionalism and discipline of his/her department or unit. He/she assesses and mitigates security risks, prepares operation orders, and oversees responses to incidents and emergencies."
13492,"Community, partnership and relations manager","Community, partnership and relations manager plans, directs and coordinates activities to improve community relations, and create or maintain a favourable public image and raise issue awareness for his/her organisation or client."
13493,Media and broadcasting manager,"Media and broadcasting manager plans, organises, directs, controls and evaluates operations, such as content localisation and commissioning, regulatory compliance, programme scheduling etc, within media production companies and broadcasting facilities."
13499,"Other professional, financial, community and social services managers n.e.c.","This group includes professional, financial, community and social services managers not elsewhere classified."
14110,Hotel operations/Lodging services manager,"Hotel operations/Lodging services manager plans, directs and controls the organisation, administration and operation of departments, such as reception, housekeeping, purchasing and maintenance. He/she establishes and maintains standards of personnel performance and services to guests."
14121,Restaurant manager,"Restaurant manager plans, organises and directs the operations of a restaurant to provide food and beverages to customers. He/she performs restaurant support functions, such as customer service, scheduling, handling day-to-day operations, cashiering, closing of the till, ordering inventory, and back office support. He/she oversees the recruitment, training and motivation of staff, and maintains quality control, hygiene, and health and safety standards in the dining area. He/she manages inventories and interacts with customers, wait staff and supports employees to ensure efficient operation."
14122,Catering manager,"Catering manager plans, organises, coordinates and directs food and beverages catering operations. He/she arranges banqueting and other special functions. He/she formulates sales strategies and works out different sales tools to achieve revenue goals by attracting various targeted group of guests/customers."
14123,Food and beverage operations manager,"Food and beverage operations manager plans, organises, coordinates and directs food and beverages (F&B) operations, including those related to central kitchen. He/she creates and maintains Standard Operations Procedures (SOP) for the F&B business, including F&B administration and food safety and hygiene practices. He/she maintains brand standards and establishes the brand concept and strategy."
14201,Retail manager,"Retail manager plans, organises, coordinates and controls the operations of establishments that sell goods on a retail basis. He/she oversees the budgets, staffing, and strategic and operational direction of retail shops."
14202,Wholesale trade manager,"Wholesale trade manager plans, organises, coordinates and controls the operations of establishments that sell goods on a wholesale basis. He/she oversees the budgets, staffing, and strategic and operational direction of wholesale shops."
14310,Sports centre manager,"Sports centre manager plans, organises and controls the operations of establishments that provide sporting services."
14321,Casino operations manager,"Casino operations manager oversees the day-to-day operations of gaming facilities. He/she ensures that all gaming rules are followed, and monitors compliance with regulatory requirements."
