ssoc,title,description
52302,Cashier (general),"Cashier (general) receives cash and gives change in retail stores, theatres or other establishments in payment for goods or services. He/she checks the amount due, collects money, gives change and issues receipts or tickets as required."
52303,Office cashier,"Office cashier takes charge of cash and keeps records of cash transactions incident to the conduct of a business, usually in an office. He/she receives incoming cash, checks it against sales slips or cash receipts, makes change and cashes cheques."
52309,"Other cashiers, ticket and related clerks","This group includes cashiers, ticket and related clerks not elsewhere classified."
52411,Fashion model,"Fashion model wears and displays clothing and accessories and poses for photographs, film and video, advertising, still photography or for artistic creation to promote products. He/she strikes the right pose in front of a camera and ensures his/her appearance is in order."
52419,Other models (e.g. artist's model),This group includes models not elsewhere classified.
52421,Sales demonstrator,"Sales demonstrator gives demonstrations of articles for sale at commercial premises, exhibitions and private homes. He/she explains the merits of an article and shows how it works, attempting to stimulate buying interest."
52422,Salesperson (door-to-door),"Salesperson (door-to-door) describes, demonstrates and sells goods and services and solicits business for establishments by approaching or visiting potential customers, usually residents in private homes, by going from door to door. He/she gives details of what establishment can supply and quotes prices and terms."
52440,Telemarketer,"Telemarketer contacts existing and prospective customers, using the telephone or other electronic communications media to promote goods and services, obtain sales and arrange sales visits."
52491,Petrol station attendant,"Petrol station attendant sells fuel, lubricants and other automotive products and provides services such as fuelling, cleaning and lubricating. He/she ascertains the customer's requirements and supplies petrol, oil, air or water."
52492,Food service counter attendant,"Food service counter attendant serves customers at food counters and finishes preparation of simple food items in restaurants, cafés, hotels, fast food outlets, cafeterias, hospitals and other settings. He/she performs duties such as taking orders and serving food and beverages. He/she serves customers at a counter or from a steam table by taking payments and preparing food and beverages."
52499,Sales workers n.e.c. (e.g. ship chandler),This group include sales workers not elsewhere classified.
53111,Babysitter/Infant care-giver,"Babysitter/Infant care-giver provides short-term care services to children on the premises of the employer, or other locations depending on the employer's needs. He/she organises play activities and entertains children with games and other cultural and educative activities according to their respective age."
53112,Confinement nanny,"Confinement nanny performs neonatal care such as feeding, nursing, and changing diapers, clothes, and bedding. He/she provides advice on postpartum contractions, lochia observation and ensures a healthy environment for both mother and baby by preparing nutritious meals, practicing maternal healthcare, and performing basic domestic services such as sweeping and mopping. He/she may monitor the baby's development such as by regular measurement of the baby's body temperature, height and weight."
53113,Child/After school care centre worker,Child/After school care centre worker provides care for children when the parents or family members are unavailable. He/she looks after the children's basic needs and helps or supervises them during play and study.
53114,Child/Youth residential care assistant,"Child/Youth residential care assistant cares for children in private households and provides support and expertise to parents in satisfying children's physical, emotional, intellectual, and social needs. He/she is also involved in meal planning and preparation, laundry and clothing care, organisation of play activities and outings, discipline, intellectual stimulation, language activities, and transportation."
53115,Educarer,Educarer works closely with young children between the ages of 2 months and 4 years and their families to ensure that the best care is provided for their children. He/she nurtures the curiosity in and supports the unique needs of each child.
53120,Teacher aide,"Teacher aide performs non-teaching duties to assist teaching staff, and provides care and supervision for children in schools and pre-schools. He/she performs duties that are instructional in nature, works closely with teachers to support the teaching and learning of primary and secondary school students in both academic and non-academic areas."
53201,Healthcare assistant (e.g. therapy aide/assistant),"Healthcare assistant works together in a team with registered nurses within the occupational fields of nursing, care and maintenance of people of all age-groups in all diverse acute care settings as well as in primary care environments. He/she sets up, prepares, checks, and cleans materials, tools, treatment areas and equipment for therapy of patients. He/she may transfer patients to and from treatment areas under the instructions of a therapist."
53202,Nursing aide/assistant,"Nursing aide/assistant provides or assists with basic care and support under the direction of licensed nursing staff. He/she performs duties such as monitoring of health status, feeding, bathing, dressing, grooming, toileting, or ambulation of patients in a health or nursing facility, medication administration and other health-related tasks."
53203,Dental aide/assistant,"Dental aide/assistant performs limited clinical duties under the direction of a dentist, including equipment preparation and sterilization, preparing patients for treatment, assisting the dentist during treatment, and providing patients with instructions for oral healthcare procedures. He/she may perform administrative duties such as scheduling appointments, maintaining medical records, billing, and coding information for insurance purposes."
53209,"Other personal care workers (e.g. old folks' home, nursing home, home care)",This group includes personal care workers not elsewhere classified.
54110,Fire-fighting and rescue officer,"Fire-fighters and rescue officer prevents, fights and extinguishes fires and assists in other emergencies, protects life and property and conducts rescue efforts."
54121,Police officer,Police officer performs surveillance and patrol activities to prevent crimes. He/she uses investigation methods to pursue and apprehend criminals while protecting the public from violent and criminal activities.
54122,Narcotics officer,Narcotics officer investigates and conducts undercover operations to gather evidence and arrest drug offenders during field operations.
54123,Auxiliary police officer,"Auxiliary police officer protects assigned premises, assets and personnel. He/she maintains law and order, and safeguards premises from potential security threats. He/she also performs access control, security screening, regulating traffic duties, patrolling and guarding services, and manages incidents and emergencies."
54130,Prison officer,"Prison officer watches over and maintains order among inmates of prisons, reformatories or penitentiaries. He/she supervises inmates in a correctional facility and ensures the security and peace-keeping in the facility. He/she performs checks and searches to ensure compliance to regulations in addition to monitoring visitations and the activities of inmates."
54141,Senior security supervisor,"Senior security supervisor leads his/her security team in providing protection to assigned premises, assets and personnel. He/she plans, deploys and conducts security operation audits, as well as assesses security risks and their mitigation. He/she conducts after action reviews, assesses performance of security personnel and develops training plans."
54142,Security supervisor,"Security supervisor assists the senior security supervisor in leading the security team which protects assigned premises, assets and personnel. He/she assigns areas to be patrolled by guards on a regular basis and transfers the individual caught trespassing to police custody. He/she also handles medical incidents, compiles incident reports, liaises with and provides relevant information requested by other departments."
54143,Senior private security officer,"Senior private security officer protects assigned premises, assets and personnel. He/she manages key press, regulates traffic, attends to enquiries from stakeholders, performs surveillance at the command centre, operates security systems, provides assistance to law enforcement and manages incidents and emergencies."
54144,Private security officer,"Private security officer protects assigned premises, assets and personnel. He/she performs access control, conducts security screening, attends to enquiries from stakeholders, patrols and guards premises, as well as manages incidents and emergencies."
54150,Lifeguard,"Lifeguard looks after the safety of people at beaches or swimming pools through accident prevention and rescue and educates the public on water safety. He/she monitors and ensures safety in the aquatic facility by preventing and responding to any emergencies. He/she identifies potential risks, advises individuals on proper behaviour and dangerous zones, and conducts life-saving techniques such as first aid."
54191,Private investigator,"Private investigator conducts private investigations for commercial, other establishments or individuals. He/she investigates shoplifting, theft, dishonesty or other undesirable conduct among employees or customers of a business establishment or other private organisations."
54192,Industrial investigator,Industrial investigator investigates and determines facts in connection with spurious goods at the request of manufacturing companies or establishments. He/she investigates source of goods known to be imitations and makes detailed reports to his/her employers.
54193,Insurance investigator,"Insurance investigator investigates, analyses, and determines the facts in connection with spurious claims at the request of insurance companies. He/she corresponds with or interviews medical specialists, agents, witnesses, or claimants to compile information."
54194,Park ranger,"Park ranger supervises and coordinates activities of workers engaged in silvi-cultural work in park ranges. He/she supervises the silvi-cultural work such as poison-girdling, planting thinning and enumeration of trees in a specific park range."
54199,Other protective services and related workers n.e.c.,This group includes protective services and related workers not elsewhere classified.
59000,Service worker n.e.c.,This group includes service workers not elsewhere classified in Unit Groups 5111-5419.
61110,Vegetable farm worker,"Vegetable farm worker performs farming operations to grow and harvest various types of field crops such as rice and other cereals, beetroot, sugar-cane, ground-nuts, tobacco, reed or other field crops and potatoes, cabbages or other field vegetables, for sale or delivery on a regular basis to wholesale buyers, marketing organisations or at markets."
61131,Landscape and plant nursery supervisor,"Landscape and plant nursery supervisor plans work schedules and assigns duties to gardeners, horticultural and nursery workers. He/she implements plant propagation practices, and maintains and monitors production systems in addition to ensuring that plants are in the optimal condition for sale or delivery for landscape projects."
61132,Plant nursery worker,"Plant nursery worker operates a plant nursery to cultivate and maintain trees, shrubs, flowers and other plants for sale or delivery for landscape projects. He/she performs tasks such as plant propagation, watering, pruning, fertilising, and pest or disease treatment."
61133,Gardeners and horticultural worker,"Gardeners and horticultural worker performs operations work in nurseries or greenhouses for the production of horticultural crops. He/she cultivates flowers, trees, shrubs and other plants in parks or in public or private gardens."
61210,Livestock/Dairy farm worker,"Livestock/Dairy farm worker breeds and raises domesticated animals (excluding poultry), such as cattle, sheep, pigs, goats, horses and camels, for the production of meat, milk and other dairy products, skins and wool or for use as working, sporting or recreational animals, for sale or delivery to wholesale buyers, marketing organisations or at markets."
61221,Poultry farm worker,"Poultry farm worker performs farming operations to breed and raise poultry for eggs or meat. He/she specialises in raising poultry, such as fowls, ducks, geese and turkeys."
61222,Poultry inseminator,Poultry inseminator collects semen from roosters and fertilises hens to obtain hatching eggs. He/she injects semen into oviduct of hen using a calibrated syringe and maintains records of insemination.
61900,Agricultural worker n.e.c.,This group includes agricultural workers not elsewhere classified in Sub-major Group 61 ‘Agricultural Workers'.
62211,Fish/Prawn farm worker,"Fish/Prawn farm worker performs a variety of tasks in the breeding and raising of fishes and prawns. He/she obtains and hatches fish eggs or buys young fish (fry) from fish hatcheries. He/she collects, sorts and markets fishes and prawns for food or for stocking rivers, lakes and other fishing grounds."
62212,Aquarium fish farm worker,"Aquarium fish farm worker breeds and raises aquarium fish for sale. He/she buys young fish (fry) and transfers fry to aquariums and provides required foods. He/she collects, sorts and packs aquarium fish for sale."
62219,Other aquatic life cultivation workers (e.g. oyster farm worker),This group includes aquatic life cultivation workers not elsewhere classified.
62220,Coastal waters/Deep sea fishery worker,"Coastal waters/Deep sea fishery worker, alone, or either as skipper or member of fishing crews, catches fish or gathers other forms of aquatic life in deep sea, inland or coastal waters for sale or delivery to wholesale buyers, marketing organisations or at markets."
71000,Supervisor/General foreman (building and related trades),"Supervisor/General foreman (building and related trades) supervises activities of a distinct unit at a construction site, controls and coordinates the activities of workers who are engaged in various occupations."
71120,Bricklayer/Blocklayer,"Bricklayer/Blocklayer lays bricks, pre-cut stones and other types of building stones in mortar to construct and repair walls, partitions, arches and other structures."
71130,"Stone cutter, splitter, carver and stonemason","Stone cutter, splitter, carver and stonemason cuts and shapes hard and soft stone blocks and slabs for the construction and maintenance of stone structures and monumental masonry and carves designs and figures in stones."
71141,Concrete form worker,"Concrete form worker builds, assembles, places in position and dismantles rough wooden structures (shuttering) into which concrete is poured and allowed to set. He/she marks out, cuts and adjusts wood to be assembled in shuttering partitions or assembles shuttering from prefabricated wooden parts."
71142,Cement finisher/Screeder,"Cement finisher/Screeder finishes surfaces of concrete structures and smooths surfaces of freshly poured concrete sections. He/she cuts ridges, bumps and projecting wire from concrete surface with chisel and hammer. He/she patches holes and broken corners by wetting them."
71149,"Other concrete placers, concrete finishers and related workers","This group includes concrete placers, concrete finishers and related workers not elsewhere classified."
71151,Carpenter,"Carpenter cuts out, assembles, erects and repairs structural and other woodwork at work bench and on construction site. He/she works from plans, sketches or instructions received and marks out reference points accordingly to facilitate cutting and shaping."
71152,Joiner,"Joiner fits, assembles and installs wooden internal and external fixtures of buildings such as door and window frames, facings and panelling in workshop or on site. He/she may make parts of woodwork."
71191,Scaffolder,"Scaffolder erects temporary metal or wooden scaffolding on building sites for construction, renovation, exterior painting and similar purposes. He/she fixes upright members in place and secures horizontal members to uprights to support platforms."
71192,Cladding/Curtain wall erector,Cladding/Curtain wall erector installs cladding and curtain wall for the external walls of buildings.
71199,Other building frame and related trades workers n.e.c. (e.g. steeplejack),This group includes building frame and related trades workers not elsewhere classified.
71210,Roofer,"Roofer builds and repairs roofs on all types of buildings using one or more kinds of materials. He/she builds, repairs and covers roofs of structures with shingles, slate, asphalt, aluminium, wood, or related materials. He/she may spray roofs, sidings, and walls with material to bind, seal, insulate, or soundproof sections of structures."
71220,Floor/Wall tiler,"Floor/Wall tiler installs, maintains and repairs flooring, and covers floors, walls and other surfaces with tiles or mosaic panels for decorative or other purposes. He/she cuts tiles to the right size and shape, prepares the surface, and puts the tiles in place flush and straight."
71230,Plasterer,"Plasterer installs, maintains and repairs plasterboard in buildings, and applies decorative and protective coverings of plaster, cement and similar material to the interiors and exteriors of structures. He/she applies one or more coats of plaster to interior walls and ceilings of buildings to produce a finished surface."
71241,Refrigeration/Air-conditioning equipment insulator,"Refrigeration/Air-conditioning equipment insulator applies and repairs insulating materials to buildings, boilers, pipes or refrigeration and air-conditioning equipment. He/she examines plans, specifications and work sites to determine the type, quality and quantity of insulation material required."
71242,Boiler/Pipe insulator,"Boiler/Pipe insulator applies insulating material such as asbestos, cork, felt or mineral wool to exposed surfaces of equipment such as boilers, pipes and tanks."
71249,Other insulation workers,This group includes insulators workers not elsewhere classified.
71250,Glazier,"Glazier measures, cuts, finishes, fits and installs flat glass and mirrors. He/she cuts glass with cutting tool according to pattern or outline and smooths rough edges."
71261,Plumber,"Plumber assembles, installs and maintains pipes, fittings and fixtures of drainage, heating, water supply and sanitary systems. He/she examines drawings and other specifications, locates and marks position of pipe and pipe connections and passage holes for pipes in walls and floors."
71262,Pipe fitter,"Pipe fitter assembles, installs and maintains high-pressure and low-pressure systems of metal pipes for conducting air, gas, steam, oil, water and other fluids. He/she finds and repairs leaks, joints, couplings and other fittings."
71263,Pipe/Drain layer,"Pipe/Drain layer lays pipes of glazed and unglazed clay, concrete, cast-iron and other materials in ditches to form sewers, drains, water mains and conduits for cables and other purposes. He/she smooths bottom of ditch to proper level and cuts out place for bell end of pipe."
71271,Air-conditioning/Refrigeration equipment mechanic,"Air-conditioning/Refrigeration equipment mechanic maintains and repairs industrial, commercial and domestic air-conditioning and refrigeration systems and equipment."
71272,Air-conditioning/Refrigeration plant installer,"Air-conditioning/Refrigeration plant installer installs residential central air-conditioning systems, commercial and industrial refrigeration and air-conditioning systems."
71290,Building finisher and related trades worker n.e.c.,This group includes building finisher and related trades worker not elsewhere classified in Minor Group 712 ‘Building Finishers and Related Trades Workers'.
71311,Building painter,"Building painter paints walls, equipment, buildings, bridges, and other structural surfaces, using brushes, rollers, and spray guns. He/she may remove old paint to prepare surface prior to painting and mix colours or oils to obtain the desired colour or consistency."
71312,Wall/Ceiling paperhanger,"Wall/Ceiling paperhanger covers interior walls and ceilings of buildings with wallpaper. He/she removes old paper with scraper, water and chemicals, and also cleans surface, fills cracks and holes with plaster and brushes sizing on surfaces."
71321,Structural steel/Ship painter,"Structural steel/Ship painter applies coatings of paint, red lead, bituminous emulsion and similar protective materials on bridges, ships' hulls and metal superstructure, steel framework of buildings, storage tanks and other metal structures. He/she rigs up scaffolding, cradles, ladders and other equipment, and scrapes dirt, rust or scale from surface to be painted."
71322,Motor vehicle spray painter,"Motor vehicle spray painter paints automotive vehicles such as automobiles, buses and trucks. He/she removes paint from vehicle or damaged parts using paint solvent and scraper, applies base coating and rubs it down to smooth surface."
71323,Sign painter,"Sign painter plans, lays out, and paints letters and designs to make signs. He/she prepares layout for sign, marks outlines of letters and designs directly on surface to be painted, or transfers outline from paper to surface to be painted."
71324,"Spray painter (except ships, motor vehicles and signs)","Spray painter (except ships, motor vehicles and signs) applies decorative and protective coatings of paint, enamel and lacquer on metal, wooden and other manufactured articles with a hand-spraying device. He/she selects and mixes paints to obtain the desired colour, and pours coating material into tank of spraying device."
71329,Other painters and related workers,This group includes painters and related workers not elsewhere classified.
71331,Building maintenance worker,"Building maintenance worker keeps structures such as office buildings, apartment houses, hotels and factory buildings in good condition. He/she performs concreting, bricklaying, carpentry, painting and other construction maintenance duties, and replaces defective electrical switches and other fixtures."
71332,Building structure cleaner and related worker,"Building structure cleaner and related worker cleans and refurbishes building exteriors, carpets, chimneys, industrial equipment, ventilation systems, windows and other surfaces, using specialised equipment and techniques."
72000,"Supervisor/General foreman (metal, machinery and related trades)","Supervisor/General foreman (metal, machinery and related trades) supervises production activities within a distinct unit of an establishment concerned with fabrication of metal products, preparation and erection of metal structures, or fitting and installing mechanical, and controls and coordinates the activities of workers in various occupations."
72110,Metal moulder and coremaker,Metal moulder and coremaker makes moulds and cores for casting metal.
72120,Welder and flame cutter,"Welder and flame cutter welds and cuts metal parts using gas flame, electric arc and other sources of heat to melt and cut, or to melt and fuse metal."
72130,Sheet metal worker,"Sheet metal worker makes, installs and repairs articles and parts of articles made out of sheet metal such as sheet steel, copper, tin, brass, aluminium, zinc or galvanised iron."
72140,Structural metal preparer and erector,"Structural metal preparer and erector assembles, erects and dismantles structural metal frames of buildings and other structures."
72150,Rigger and cable splicer,"Rigger and cable splicer assembles rigging gear to move and position equipment and structural components, or to install and maintain cables, ropes and wires on construction sites, buildings or other structures."
72210,"Blacksmith, hammersmith and forging-press worker","Blacksmith, hammersmith and forging-press worker, hammers and forges bars, rods or ingots of iron, steel and other metals to make and repair various kinds of tools, equipment and other articles, sets machine tools for operators or sets and operates various machine tools and polishes and sharpens surfaces."
72221,Tool and die maker,"Tool and die maker fits and assembles parts to make and repair metal-working dies, cutting tools, jig, fixtures, gauges, and machinists' hand tools. He/she studies drawings, models and other specifications, computes dimensions, plans layout and assembly operations."
72222,Locksmith,"Locksmith assembles, installs and repairs locks. He/she examines lock parts to check accuracy of fit; chisels, files, scrapes and does other supplementary tooling to correct inaccuracies."
72229,Other toolmakers and related workers,This group includes toolmakers and related workers not elsewhere classified.
72240,"Metal polisher, wheel grinder and tool sharpener","Metal polisher, wheel grinder and tool sharpener polishes and grinds metal surfaces and sharpens tools."
72310,Automotive mechanic,"Automotive mechanic fits, installs, maintains, services and repairs engines and the mechanical and related equipment of passenger cars, delivery trucks, motorcycles and other motor vehicles."
72320,Aircraft engine mechanic and repairer,"Aircraft engine mechanic and repairer fits, services, repairs and overhauls aircraft engines and assemblies, such as airframes, hydraulic, and pneumatic systems."
