ssoc,title,description
31182,Electrical/Electronics draughtsman,"Electrical/Electronics draughtsman prepares working drawings from a designer's sketches and specifications for manufacture and installation of electrical and electronic machinery and equipment. He/she specialises in preparing working drawings and detailed specifications for the manufacture, installation and wiring of electrical machinery and appliances, switchgear, electronic equipment and other electrical products."
31183,Civil/Structural engineering draughtsman,"Civil/Structural engineering draughtsman prepares working drawings from a designer's sketches and specifications for use in civil engineering projects. He/she specialises in preparing working drawings and detailed specifications for the construction of bridges, dams, tunnels, railways, roads, industrial and other large buildings, waste disposal and flood control systems and other civil engineering projects. He/she may specialise in preparing working drawings for construction of large steel-framed or reinforced concrete structures and be designated accordingly."
31184,Architectural draughtsman,"Architectural draughtsman specialises in preparing working drawings from architectural sketches and detailed specifications for the construction of buildings. He/she works with engineers regarding model accuracy, design, drafting standards and design documentation, produces structural drawings based on design drawings and verifies the consistence and makes adjustment to structural drawings, construction drawings and finishing works drawings."
31185,Marine draughtsman,"Marine draughtsman prepares working plans, technical specifications, budgets and other technical drawings, from sketches or notes, for parts or for whole marine structures. He/she specialises in making drawings for structural features of ships, floating docks and other marine structures and equipment. He/she also follows up with shipyards, ship designers and consultants for the fitted drawings, class approval and documentation."
31189,Other draughtsmen (e.g. cartographical draughtsman),This group includes draughtsmen not elsewhere classified.
31211,Aeronautical engineering technician,"Aeronautical engineering technician performs technical tasks, normally under the direction of an aeronautical engineer, contributory to design, development, construction, maintenance and repair of aircraft. He/she specialises in airframes, undercarriages, braking systems and other mechanical equipment for aircraft. He/she may specialise in a particular type of aircraft, such as passenger, cargo or military aircraft or helicopters."
31212,Automotive engineering technician,"Automotive engineering technician performs technical tasks, normally under the direction of an automotive engineer, contributory to design, development and manufacture of road vehicles. He/she specialises in bodies, suspension systems, brakes and other mechanical components for road vehicles and may specialise in a particular type of vehicle or component."
31213,Marine surveyor (ship and nautical),"Marine surveyor (ship and nautical) inspects vessels intended for operations in maritime or open sea waters. He/she develops and monitors the implementation of safety standards and procedures for marine survey work in relation to ships' hulls, equipment and cargoes and also ensure that vessels and equipment follow the regulations laid down by the International Maritime Organisation (IMO). He/she may also act as third parties for the review of offshore facilities and construction projects."
31214,Rolling stock engineering technician,"Rolling stock engineering technician performs preventive and corrective maintenance activities as well as modification and/or overhaul works on trains and its components. He/she conducts fault analyses, repairs of electronics, electrical and mechanical equipment of trains as well as performing routine vehicle inspections in accordance to maintenance procedures and instructions. He/she may also supervise the work of contractors and external stakeholders to ensure adherence to operating standards and safety standards."
31291,Mechatronics technician,"Mechatronics technician collaborates with engineers in the development of mechatronic devices and applications through a combination of mechanical engineering, electronic engineering, and computer engineering. He/she builds, tests, installs, and calibrates mechatronics and solves technical problems."
31292,Metallurgical technician,"Metallurgical technician performs technical tasks, normally under the direction of metallurgists or petroleum and natural gas engineers, contributory to the extraction, storage, development and transportation of metals, metal alloys, petroleum and natural gas. He/she sets up and carries out tests and analyses, takes readings, performs calculations, adjusts instruments, records observations and otherwise assists in research to develop new or improved extractive and processing methods for metals, metal alloys, petroleum and natural gas deposits. He/she assists in technical supervision of extractive and metal-making and treatment processes to ensure compliance with specifications."
31293,Precision optics technician,"Precision optics technician performs optical processes in the manufacture of precision lenses and other optic elements. He/she reads and interprets lens specifications from blue prints and schematics, draws work orders, and selects premixed compounds according to formula. He/she also sets up, operates and maintains polishing equipment and performs manual and Computer Numerical Control (CNC) assisted grinding and polishing precision sphere lenses."
31294,Quantity surveying technician,"Quantity surveying technician works under the supervision of a quantity surveyor and uses architects' drawings to work out costings for building projects, and monitors site work to estimate costs of the project at different stages so that progressive payment can be made to building contractors."
31295,Airport maintenance technician,"Airport maintenance technician maintains equipment necessary for ensuring the functionality of the airport, for example, visual aids, airport electrical systems, luggage systems, security systems, etc."
31299,Other physical and engineering science technicians n.e.c.,This unit group covers physical and engineering science technicians not elsewhere classified.
31310,Power generating plant operator,"Power generating plant operator operates, monitors and maintains switchboards and related equipment in electrical control centres which control the production and distribution of electrical or other power in transmission networks. The equipment operated includes reactors, turbines, generators and other auxiliary equipment in electrical power-generating stations."
31321,Stationary engine operator,"Stationary engine operator operates and monitors various types of stationary engines and related mechanical equipment. He/she checks and adjusts controls, observes gauges and meters which indicate the engine's performance and operating conditions, such as temperature and oil pressure, and makes further adjustments if necessary."
31322,Compressor operator,"Compressor operator operates and monitors steam, gas, electric motor, or internal combustion-engine driven compressors. He/she starts the power unit and builds up required pressure, manipulates controls or sets the automatic regulator to maintain a supply of air to equipment, observes pressure, temperature and other gauges and makes further adjustments to control as necessary. He/she cleans and oils equipment, tightens loose parts and performs other servicing tasks to keep the compressor in good running order."
31323,Pumping station operator,"Pumping station operator operates and monitors pumping and siphoning equipment to transfer liquids, gases, semi-liquids and powdered substances from one location to another. He/she opens and sets valves, operates turbine-and motor-driven pumps, reads and interprets flow-meters and pressure and level gauges, regulates equipment according to needs or instructions and makes repairs and adjustments. He/she maintains logs concerning quantities pumped, utilisation of equipment and other matters. He/she may operate hydroelectric equipment to generate power for operating water-pumping equipment."
31324,Water treatment machine operator (waterworks),"Water treatment machine operator (waterworks) operates and monitor treatment plant equipment to purify water for human consumption and industrial use. He/she controls the flow of raw water into plant by starting and regulating operation of electric motors, pumps and valves, adds specified amounts of chemicals to disinfect, deodorise and clarify water, or adjusts automatic devices which admit chemicals in controlled dosages. He/she starts agitators to mix ingredients and filters water through filtering material. He/she pumps purified water into water mains, monitors control panel meters and gauges to determine rate of flow and other factors."
31325,Refrigeration system operator,"Refrigeration system operator operates and monitors refrigeration system which provides cooling medium for industrial processes, preserving foods, cooling buildings or for other purposes. He/she starts and stops electric motors, pumps, compressors, coolers or other equipment related to refrigeration system, as required. He/she observes thermometers, pressure gauges and other instruments relating to performance of engines and operating conditions in the plant."
31329,Other incinerator and water treatment plant and related machine operators,This group includes incinerator and water treatment plant and related machine operators not elsewhere classified.
31331,Chemical processing and chemical products plant controller,"Chemical processing and products plant controller operates and monitors chemical (excluding phamaceutical) plants and related multi-function process control machinery, and adjusts and maintains processing units and equipment which distil, filter, separate, heat or refine chemicals."
31332,Pharmaceutical products machine controller,"Pharmaceutical products machine controller operates and monitors phamaceutical plants and related multi-function process control machinery, and adjusts and maintains processing units and equipment which distil, filter, separate, heat or refine pharmaceutical products."
31341,Petroleum and natural gas refining plant operator,"Petroleum and natural gas refining plant operator operates and monitors plants, and adjusts and maintains processing units and equipment which refine, distil and treat petroleum, petroleum-based products and by-products, or natural gas."
31342,Cylinder filler/tester (compressed and liquefied gases),"Cylinder filler/tester (compressed and liquefied gases) tends pumps or other equipment to fill cylinders or other containers with liquefied or compressed gases. He/she connects lines from filling point to cylinders, adjusts valves and observes gauges to fill cylinders to prescribed pressure or weight. He/she tests for leaks in cylinders, records weight or pressure cylinder number and date filled. He/she may also check the purity of gases by simple chemical tests."
31350,Metal production process controller,"Metal production process controller operates and monitors multi-function process control machinery and equipment to control the processing of metal converting and refining furnaces, metal-rolling mills, metal heat-treating or metal-extrusion plant."
31391,Remote crane operator,Remote crane operator controls multiple types of equipment for cargo movement remotely through a control centre/system. He/she inspects the equipment and work site prior to equipment set-up.
31392,Automated assembly line/Industrial robot operator,"Automated assembly line/Industrial robot operator monitors and operates automated or semi-automated assembling lines or industrial robots to perform various manufacturing activities such as lifting, welding and assembling. He/she ensures that the assembly line or industrial robots are working correctly and in sync with other processes."
31399,Other process control technicians n.e.c.,"This group covers process control technicians not elsewhere classified in Minor Group 313 'Process Control Technicians'. For instance, the group includes those who operate multiple process control equipment in manufacturing assembly lines and paper and pulp production."
31411,Biological technician,"Biological technician provides technical assistance in researching and analysing the relationship between living organisms and their environment. He/she sets up laboratory instruments and equipment, collects and analyses data for experiments and examines organic substances such as bodily fluids, drugs, plants and food. He/she also compiles reports and maintains laboratory stock."
31412,Clinical research coordinator,"Clinical research coordinator plans, directs, or coordinates clinical research projects. He/she assists to schedule and perform research-related procedures and follow-ups to clinical studies, in compliance with protocols, guidelines and other regulatory and ethical requirements, liaises between clinical trial sponsors and investigators and coordinates study-related finances and logistics. He/she enters and validates study data, extracts relevant information from medical records, performs counselling to patients and families and also handles administration work."
31419,Other life science technicians,This group includes life science technicians not elsewhere classified.
31421,Horticultural technician (including irrigation specialist),"Horticultural technician provides technical support in the preparation of soil specimens, and helps to identify pathogenic micro-organisms and insects, parasites, fungi and weeds harmful to crops. He/she conducts tests and experiments to improve yield and quality of crops or to increase the resistance of plants to disease or insects, assists in devising methods of control against attacks on crops, and conducts or supervises production programmes. He/she nurtures plants and operates equipment and machinery to facilitate daily work. He/she may also transport and set up greenery for clients at various locations."
31422,Plant tissue culture technician,"Plant tissue culture technician provides technical support in the initiation of explants from mother plants, transfer of existing plant tissue cultures, selection of appropriate media for optimal plant culture growth, micro propagation, and also implements sterile techniques with minimal contamination."
31423,Farming technician (animal production),"Farming technician (animal production) assists agricultural scientists by providing technical support in the preparation of specimens such as animal cells, tissues or parts or animal organs and the conduct of experiments, tests and analysis. He/she assists in devising preventive controls against outbreak of diseases on livestock, and conducts or supervises operational programmes such as fish hatchery and livestock production programmes."
31510,"Marine engineering officer (including third, fourth and fifth engineer)","Marine engineering officer controls, supervises and participates in the operation, performance, maintenance and repair of mechanical, electrical and electronic equipment and machinery on board ship."
31521,"Ship's deck navigating officer (including second, third and fourth mate)","Ship's deck navigating officer plans, supervises and coordinates deck and bridge-watch activities on seagoing or inland waterways vessel. He/she assists the ship master in navigation of vessel in accordance with his/her instructions through determining position and course of vessel by use of charts, compasses, radar and other navigational aids."
31522,Harbour pilot,"Harbour pilot provides pilotage and berthing services, and ensures the safe and expedient movement of ships entering and departing the port. He/she complies with port regulations and emergency response plans."
31529,Other ships' deck officers and pilots,This group includes ships' deck officers and pilots not elsewhere classified.
31540,Air traffic controller,"Air traffic controller directs aircraft movements in airspace and on the ground, using radio, radar and lighting systems and provides information relevant to the operation of aircraft."
31560,Sea traffic controller,"Sea traffic controller commands, navigates and directs ships, using radio and radar. He/she provides information and directions to ensure safe and efficient movement and operation of ships."
31571,Air transport service supervisor,"Air transport service supervisor supervises airport and airline operations and activities such as baggage, ramp, cargo, load control, in-flight catering, and passenger/customer services. He/she maintains the lines of communication with the various stakeholders during flight disruptions. He/she enforces passenger safety and security standards and investigates the root causes of safety and security breaches."
31572,Train service supervisor,"Train service supervisor supervises train service and station operations and activities. He/she supervises the station staff and executes crew (re)deployment plans to maintain train service standards and reliability, as well as safety standards of train operations. He/she conducts regular inspections of station premises and facilities to ensure station equipment are operational. He/she manages service and repair requirements for station equipment and facilities, and carries out access control for maintenance teams and/or service providers to perform maintenance work on rail systems and/or station facilities."
31573,Road transport supervisor,Road transport supervisor supervises road transport (e.g. bus) and depot operations and activities. He/she oversees day-to-day depot and interchange operations and manages the deport and interchange's facilities and security. He/she monitors and regulates the road transport services and (re)deployment of drivers to ensure service reliability.
31574,Port/Shipping operations supervisor (including post-fixture and planner),"Port/Shipping operations supervisor supervises port and shipping operations and activities. He/she oversees the planning and sequencing of the loading and unloading of cargo from ships, the placement of cargo in the yard and the lashing operations. He/she monitors a ship schedule and its status before arrival at the ports, the delivery and re-delivery notices for ships and arranges for hire payments."
31579,Other transport operations supervisors,This group includes transport operations supervisors not elsewhere classified.
31591,Port master/Dockmaster,"Port master/Dockmaster supervises and coordinates activities of workers engaged in docking vessels for cleaning, painting and repair. He/she analyses vessel's blueprints and specifications to determine size, shape and number of keel and bilge blocks required to support vessel. He/she oversees flooding operations and removal of vessel from dock."
31592,Port captain,"Port captain commands or supervises operations of ships and water vessels, such as tugboats and ferryboats. He/she ensures vessel comply with legal requirements, and conducts investigation and analysis for any non-conformances, accidents, hazardous occurrences."
31593,Flight operations officer,"Flight operations officer coordinates flight planning and assists in monitoring of aircraft performance, movements, operating conditions and en-route operations. He/she gives landing and departure authorisation and instruction, examines weather data and determines changes to the flight routes. He/she advises pilots-in-command accordingly in all matters affecting diversions in addition to liaising and co-ordinating with relevant parties to minimise flight delays and passenger inconvenience."
31594,Air cargo officer,"Air cargo officer receives and despatches cargo and mail through aircraft while ensuring that they meet safety, security and airworthiness standards. He/she performs stock control and housekeeping operations to ensure that shipments are arranged, received, handled and stored properly according to Standard Operating Procedures (SOP) and handling requirements."
31595,Load control officer (aircraft),"Load-sheet officer (aircraft) ensures that structural weights of an aircraft are within safety parameters and performs weight, balance, and centre of gravity calculations for departing flights. He/she gives instructions to loading clerks on placement of cargo and mail on aircraft in addition to completing load sheet and presenting to flight commander."
31596,Train operations officer,"Train operations officer operates trains and provides passenger transport services in a safe manner while respecting all relevant safety, operational and communication regulations."
31597,Road transport operations officer,"Road transport operations officer performs day-to-day operations to support road transport services such as bus service to serve passengers. He/she monitors and regulates road transport arrival and departure timings, (re)deploys drivers to operate service routes, and conducts road transport checks to ensure service readiness. He/she responds to emergencies and restores road transport service, as well as assists in the investigation and documentation of incidents and/or accidents. He/she also takes on administrative duties in data compilation, performing traffic and crowd control and daily security checks, and providing support to respond to incidents and accidents."
31599,Other transport controllers and related workers n.e.c.,This group includes transport controllers and related workers not elsewhere classified.
31601,Premises and facilities maintenance officer,"Premises and facilities maintenance officer directs the operations of facilities that provide recreational services such as gardens, zoos and parks etc. He/she plans and organises the daily operations of the related staff and facilities and ensures the organisation follows the latest developments in its field."
31602,Landscape operations officer,"Landscape operations officer installs, manages and maintains indoor or outdoor green spaces to customer requirements. He/she upkeeps an estate or park and oversees the proper management and maintenance of trees, shrubs and premises facilities."
31603,Parks officer,Parks officer implements the park management work plan. He/she creates events and programmes to promote the use of parks and provides information about the parks and their activities and programmes to park users.
31711,Fire and safety inspector,Fire and safety inspector enforces the rules and regulations relating to fire prevention and other hazards and occupational safety. He/she detects and eliminates or reduces fire hazards in industrial plants and other establishments by using instruments and conducting special tests to determine the conditions.
31719,Other building and fire inspectors,This group includes building and fire inspectors not elsewhere classified.
31720,"Safety inspector (vehicles, processes and products)","Safety inspector (vehicles, processes and products) enforces the rules and regulations relating to safety of production processes, as well as quality standards relating to goods and services produced, used or sold. He/she may also administer and regulate quality standards manufacturing specifications."
32111,Sonographer,Sonographer produces ultrasonic recordings of internal organs for use by physicians. He/she operates or oversees operation of ultrasound and produces images of the body for diagnostic purposes while monitoring patients' conditions and reactions for abnormal signs.
32112,Medical X-ray technician,"Medical X-ray technician operates X-ray equipment to make radiographs for medical diagnostic purposes or give therapeutic treatment. He/she prepares patient for exposure to rays and, when necessary, fixes lead plates to protect parts of body not to be exposed to X-rays in addition to manipulating controls of machine to regulate the time and intensity of exposure."
32119,"Other medical imaging, therapeutic equipment technicians and related associate professionals","This group includes medical imaging, therapeutic equipment technicians and related associate professionals not elsewhere classified."
32120,Medical and pathology laboratory technician,"Medical and pathology laboratory technician performs clinical tests on specimens of bodily fluids and tissues in order to obtain information about the health of a patient or cause of death. He/she conducts analysis of human tissues and body fluids, including blood, bone marrow, urine, amniotic fluid, etc. He/she operates, calibrates and maintains simple instruments used in quantitative and qualitative analysis such as glucometer, Hemoglobin A1c (HBA1c) meter, bilirunometer, full blood count (FBC) analyser and light microscope."
32130,Pharmacy technician,"Pharmacy technician performs a variety of tasks associated with dispensing medicinal products under the guidance of a pharmacist or other health professional. He/she performs drug compounding by processing orders and preparing sterile and non-sterile products, and managing inventory and maintaining proper records and functioning of facilities."
32141,Prosthetist and orthotist,"Prosthetist and orthotist assesses patients and designs and fits suitable support instruments for individuals who have impairments, deficiencies or weaknesses due to injury, pathology or congenital malformation. He/she educates patients on how to use and maintain support instruments properly."
